{
  "schema_version": "alice.request.v1",
  "request_id": "98df68eb-684b-4bec-b34b-8155a7fa1f39",
  "thread_id": "email:alice-demo-thread-007",
  "channel": "email",
  "request_mode": "deep_research",
  "raw_user_message": "Run a first-pass diligence plan on this listing in Alabama for rural hold and light development context: https://www.land.com/property/25-acres-in-Autauga-County-Alabama/55555555/",
  "thesis": {
    "summary": "Listing-led diligence in a non-curated county where Alice should fall back to minimal county coverage honestly.",
    "use_case_hypotheses": [
      "residential_light_development",
      "recreational_rural_hold"
    ],
    "target_geographies": [],
    "filters": {
      "require_paved_access": true
    },
    "budget": {
      "currency": "USD",
      "max_purchase_price": 250000
    },
    "hold_period": {
      "min_years": 3,
      "max_years": 10,
      "target_strategy": "hold"
    },
    "return_preferences": {
      "preferred_exit_strategies": [
        "hold",
        "develop"
      ]
    }
  },
  "subjects": [
    {
      "input_kind": "listing_url",
      "raw_value": "https://www.land.com/property/25-acres-in-Autauga-County-Alabama/55555555/"
    }
  ],
  "output_preferences": {
    "verbosity": "full",
    "comparison_requested": false,
    "include_markdown_report": true,
    "include_json_artifacts": true
  },
  "conversation_state_ref": "alice/session_state.json"
}