{
  "schema_version": "alice.request.v1",
  "request_id": "11111111-1111-4111-8111-111111111111",
  "thread_id": "slack:C0ALICE:step10-user-supplied",
  "channel": "slack",
  "request_mode": "recommendation",
  "raw_user_message": "Rank these listings for solar or long-term rural hold under $700k, and keep stronger parcel certainty ahead of weaker candidates.",
  "thesis": {
    "summary": "Rank supplied listings for solar or long-term rural hold under $700k, with parcel certainty and evidence quality carrying real weight.",
    "use_case_hypotheses": [
      "energy",
      "recreational_rural_hold"
    ],
    "target_geographies": [],
    "filters": {
      "max_price": 700000,
      "prefer_transmission_proximity": true,
      "desired_coverage_tiers": [
        "full",
        "partial",
        "minimal"
      ]
    },
    "budget": {
      "currency": "USD",
      "max_purchase_price": 700000
    },
    "hold_period": {
      "min_years": 5,
      "max_years": 15,
      "target_strategy": "hold"
    },
    "return_preferences": {
      "preferred_exit_strategies": [
        "hold",
        "ground_lease"
      ]
    }
  },
  "subjects": [
    {
      "input_kind": "listing_url",
      "raw_value": "https://www.landwatch.com/texas-land-for-sale/hudspeth-county/property/80-acres-near-sierra-blanca/id/12345678?utm_source=test"
    },
    {
      "input_kind": "listing_url",
      "raw_value": "https://www.land.com/property/160-acres-near-Bakersfield-Kern-County-California/60606060/"
    },
    {
      "input_kind": "listing_url",
      "raw_value": "https://www.land.com/property/25-acres-in-Autauga-County-Alabama/55555555/"
    },
    {
      "input_kind": "listing_url",
      "raw_value": "https://www.landwatch.com/texas-land-for-sale/hudspeth-county/property/80-acres-near-sierra-blanca/id/12345678"
    }
  ],
  "output_preferences": {
    "verbosity": "standard",
    "comparison_requested": true,
    "include_markdown_report": true,
    "include_json_artifacts": true
  },
  "conversation_state_ref": "alice/session_state.json"
}