{
  "schema_version": "alice.request.v1",
  "request_id": "44444444-4444-4444-8444-444444444444",
  "thread_id": "slack:step10-conflicted",
  "channel": "slack",
  "request_mode": "recommendation",
  "raw_user_message": "Rank these observed candidates for solar first, but keep rural hold as a fallback and do not hide parcel-identity conflicts.",
  "thesis": {
    "summary": "Compare observed acreage listings for solar first, with rural hold as a fallback, while preserving parcel-identity tradeoffs.",
    "use_case_hypotheses": [
      "energy",
      "recreational_rural_hold"
    ],
    "target_geographies": [],
    "filters": {
      "prefer_transmission_proximity": true,
      "max_price": 700000
    },
    "budget": {
      "currency": "USD",
      "max_purchase_price": 700000
    },
    "hold_period": {
      "min_years": 4,
      "max_years": 15,
      "target_strategy": "mixed"
    },
    "return_preferences": {
      "preferred_exit_strategies": [
        "ground_lease",
        "hold"
      ]
    }
  },
  "subjects": [
    {
      "input_kind": "listing_url",
      "raw_value": "https://www.land.com/property/160-acres-near-Bakersfield-Kern-County-California/60606060/"
    },
    {
      "input_kind": "listing_url",
      "raw_value": "https://www.landwatch.com/texas-land-for-sale/hudspeth-county/property/80-acres-near-sierra-blanca/id/12345678"
    },
    {
      "input_kind": "listing_url",
      "raw_value": "https://www.land.com/property/25-acres-in-Autauga-County-Alabama/55555555/"
    }
  ],
  "output_preferences": {
    "verbosity": "standard",
    "comparison_requested": true,
    "include_markdown_report": true,
    "include_json_artifacts": true
  },
  "conversation_state_ref": "alice/session_state.json"
}